sumit-Inspiron-15-3580% sudo mysql
[sudo] password for sumit:
Welcome to the MySQL monitor.  Commands end with ; or \g.
Your MySQL connection id is 15
Server version: 8.0.37-0ubuntu0.22.04.3 (Ubuntu)

Copyright (c) 2000, 2024, Oracle and/or its affiliates.

Oracle is a registered trademark of Oracle Corporation and/or its
affiliates. Other names may be trademarks of their respective
owners.

Type 'help;' or '\h' for help. Type '\c' to clear the current input statement.

mysql> show databases;
+--------------------+
| Database           |
+--------------------+
| Assignment         |
| Employee           |
| information_schema |
| mysql              |
| performance_schema |
| sys                |
+--------------------+
6 rows in set (0.01 sec)



mysql> CREATE TABLE Emp (
    ->     empno INT PRIMARY KEY,
    ->     ename VARCHAR(50),
    ->     job VARCHAR(50),
    ->     mgr INT,
    ->     hiredate DATE,
    ->     sal DECIMAL(10, 2),
    ->     comm DECIMAL(10, 2),
    ->     deptno INT,
    ->     FOREIGN KEY (deptno) REFERENCES Dept(deptno),
    ->     FOREIGN KEY (mgr) REFERENCES Emp(empno)
    -> );
Query OK, 0 rows affected (0.07 sec)


mysql> INSERT INTO Dept (deptno, dname, loc) VALUES
    -> (10, 'Sales', 'New York'),
    -> (20, 'Marketing', 'Los Angeles'),
    -> (30, 'HR', 'Chicago'),
    -> (40, 'IT', 'San Francisco');
Query OK, 4 rows affected (0.01 sec)
Records: 4  Duplicates: 0  Warnings: 0

mysql> INSERT INTO Emp (empno, ename, job, mgr, hiredate, sal, comm, deptno) VALUES
    -> (101, 'Rajesh Sharma', 'Manager', NULL, '1993-07-21', 6000.00, 500.00, 10),
    -> (102, 'Sita Rai', 'Clerk', 101, '1995-01-10', 3000.00, 200.00, 10),
    -> (103, 'Rupaak Kumar', 'Salesman', 101, '2000-06-15', 3500.00, 300.00, 10),
    -> (104, 'Nisha Thapa', 'Manager', NULL, '2000-05-12', 6500.00, 400.00, 20),
    -> (105, 'jyoti Joshi', 'Analyst', 104, '2002-03-09', 4000.00, 250.00, 20),
    -> (106, 'Hari Kumar', 'HR Executive', NULL, '1990-09-30', 5000.00, 150.00, 30),
    -> (107, 'Anita Sharma', 'IT Specialist', NULL, '2015-11-22', 7000.00, 300.00, 40);
Query OK, 7 rows affected (0.01 sec)
Records: 7  Duplicates: 0  Warnings: 0

mysql> UPDATE Emp
    -> SET sal = sal * 1.15
    -> WHERE DATEDIFF(CURDATE(), hiredate) / 365 > 30;
Query OK, 2 rows affected (0.01 sec)
Rows matched: 2  Changed: 2  Warnings: 0

mysql> DELETE FROM Emp
WHERE DATEDIFF(CURDATE(), hiredate) / 365 > 30;
ERROR 1451 (23000): Cannot delete or update a parent row: a foreign key constraint fails (`Assignment`.`Emp`, CONSTRAINT `Emp_ibfk_2` FOREIGN KEY (`mgr`) REFERENCES `Emp` (`empno`))

mysql> SELECT mgr, COUNT(*) AS num_employees
    -> FROM Emp
    -> GROUP BY mgr
    -> ORDER BY num_employees DESC
    -> LIMIT 1;
+------+---------------+
| mgr  | num_employees |
+------+---------------+
| NULL |             4 |
+------+---------------+
1 row in set (0.00 sec)

mysql> CREATE VIEW EmployeeManager AS
    -> SELECT e1.ename AS Employee_Name, e2.ename AS Manager_Name
    -> FROM Emp e1
    -> LEFT JOIN Emp e2 ON e1.mgr = e2.empno;
Query OK, 0 rows affected (0.02 sec)

mysql> SELECT *
    -> FROM Emp;
+-------+---------------+---------------+------+------------+---------+--------+--------+
| empno | ename         | job           | mgr  | hiredate   | sal     | comm   | deptno |
+-------+---------------+---------------+------+------------+---------+--------+--------+
|   101 | Rajesh Sharma | Manager       | NULL | 1993-07-21 | 6900.00 | 500.00 |     10 |
|   102 | Sita Rai      | Clerk         |  101 | 1995-01-10 | 3000.00 | 200.00 |     10 |
|   103 | Rupaak Kumar  | Salesman      |  101 | 2000-06-15 | 3500.00 | 300.00 |     10 |
|   104 | Nisha Thapa   | Manager       | NULL | 2000-05-12 | 6500.00 | 400.00 |     20 |
|   105 | jyoti Joshi   | Analyst       |  104 | 2002-03-09 | 4000.00 | 250.00 |     20 |
|   106 | Hari Kumar    | HR Executive  | NULL | 1990-09-30 | 5750.00 | 150.00 |     30 |
|   107 | Anita Sharma  | IT Specialist | NULL | 2015-11-22 | 7000.00 | 300.00 |     40 |
+-------+---------------+---------------+------+------------+---------+--------+--------+
7 rows in set (0.01 sec)

mysql> SELECT * FROM Dept;
+--------+-----------+---------------+
| deptno | dname     | loc           |
+--------+-----------+---------------+
|     10 | Sales     | New York      |
|     20 | Marketing | Los Angeles   |
|     30 | HR        | Chicago       |
|     40 | IT        | San Francisco |
+--------+-----------+---------------+
4 rows in set (0.00 sec)